{
  "taskName":"test",
  "dataSource": {
    "sourceName":"Hive",
    "dbName":"fox_data"
  },
  "targetDest": {
    "targetName": "MySQL",
    "dbName":"`fox-data-bi`",
    "tableName":"v2_test",
    "columns": [
      {
        "fieldName":"sjt_name",
        "fieldType":"string"
      },
      {
        "fieldName":"class_name",
        "fieldType":"string"
      },
      {
        "fieldName":"fac_name",
        "fieldType":"string"
      }
    ]
  },
  "steps":[
    {
      "sql":"select sjtname as sjt_name,classname as class_name,facname as fac_name from fox_data.mysql_hxdb_employee_info where partition_month='2019-03' group by sjtname,classname,facname",
      "tempView":"t1",
      "macros": {}
    }
  ],
  "extra": {},
  "version":"2.0"
}